"question_flag","answer_flag","interjection_flag","speech_flag","chamber_flag","stage_direction_flag","speaker_no","name","name.id","electorate","party","role","page.no","content","subdebateinfo","debateinfo","path","Speaker","Time"
"0","1","0","0","1","0","180","Albanese, Anthony MP","R36","Grayndler","ALP","N/A","342","The whole premise of the Leader of the Opposition's question is completely wrong. He should talk to the Manager of Opposition Business about why it's wrong. The difference is, as the Manager of Opposition Business said:  If Australia had fuel efficiency standards in line with comparable nations, estimates of the fuel saving per passenger vehicle could be above $500 per year, or nearly $28 billion in total by 2040. He said that in 2017. The member for Bradfield, I am sure, can confirm that when he came up with this policy proposal I, as shadow minister, sat down with him and said there needs to be bipartisan work done on this to get it done. That was my approach. I note the Leader of the Opposition—in a press conference in order to say, 'Look over there!' while they were reversing their position on tax cuts—said that he was up for reform. He said: 'Just come to us. I want to be constructive. I want it to be like the Howard years.' What nonsense! Here we have a policy, one of the architects of which is sitting over there as his key tactician, and he asks stupid questions like that based upon absolutely nothing. Let's be very clear here: this policy says that Australia will have the same standards that the United States has by 2028. I don't know if anyone over there has watched TV or been to the US, but one of the things I noticed—","New Vehicle Efficiency Standard","QUESTIONS WITHOUT NOTICE","/hansard/chamber.xscript/debate[5]/subdebate.1[19]/answer/talk.text/body/p[1]","Mr ALBANESE (Grayndler—Prime Minister) ","(15:12):"
"0","1","0","0","1","0","181","Mr Dutton","N/A","N/A","N/A","N/A","N/A","Mr Dutton interjecting—  Mr ALBANESE: Well, apparently that's bad. Order! Mr ALBANESE: Again, the noted bipartisanship! Well, you've almost worn out Gina Rinehart's plane, mate.","New Vehicle Efficiency Standard","QUESTIONS WITHOUT NOTICE","/hansard/chamber.xscript/debate[5]/subdebate.1[19]/answer/talk.text/body/a/p","N/A","N/A"
"0","1","0","0","1","0","182","Honourable members","N/A","N/A","N/A","N/A","N/A","Honourable members interjecting—  The Minister for Resources will cease interjecting. The member for Deakin on a point of order. Mr Sukkar: We know the Prime Minister's a liar— Resume your seat. Mr Sukkar: He should be held to—  Honourable members interjecting—  You will come back to that dispatch box, you'll withdraw that comment and then you'll keep walking and leave the chamber under standing order 94 (a). Mr Sukkar: I withdraw. The member for Deakin then left the chamber.","New Vehicle Efficiency Standard","QUESTIONS WITHOUT NOTICE","/hansard/chamber.xscript/debate[5]/subdebate.1[19]/answer/talk.text/body/p[8]","N/A","N/A"
"0","1","0","0","1","0","183","Government members","N/A","N/A","N/A","N/A","N/A","Government members interjecting—  Order! Members on my right, I do not need any assistance. The Prime Minister for the remaining 25 seconds. Mr ALBANESE: Apparently now the offer of bipartisanship doesn't even extend to support for the US alliance. Everything is an opportunity to try and divide—","New Vehicle Efficiency Standard","QUESTIONS WITHOUT NOTICE","/hansard/chamber.xscript/debate[5]/subdebate.1[19]/answer/talk.text/body/p[17]","N/A","N/A"
"0","1","0","0","1","0","184","Honourable members","N/A","N/A","N/A","N/A","N/A","Honourable members interjecting—  Order! Mr Dutton: A point of order. The Leader of the Opposition will need to state the point of order. We haven't had one on relevance. Mr Dutton: On relevance, the question, again, went to a $19,000 price increase for a Mazda CX-30. The Prime Minister refuses to address that important question. Why can't he— Resume your seat. Prime Minister has seven seconds and he will remain relevant to the question. Mr ALBANESE: Having such a thin skin makes it easy to see the glass jaw. Prime Minister's time has concluded.  Honourable members interjecting—  Order! The House will come to order so I can hear from the member for Robertson.","New Vehicle Efficiency Standard","QUESTIONS WITHOUT NOTICE","/hansard/chamber.xscript/debate[5]/subdebate.1[19]/answer/talk.text/body/p[20]","N/A","N/A"
"0","0","1","0","1","0","185","Mr Dutton ","N/A","N/A","N/A","N/A","342","Mr Dutton interjecting—","New Vehicle Efficiency Standard","QUESTIONS WITHOUT NOTICE","/hansard/chamber.xscript/debate[5]/subdebate.1[19]/answer/interjection[1]/talk.start","N/A","N/A"
"0","0","1","0","1","0","186","Dick, Milton MP ","53517","Oxley","ALP","N/A","342","N/A","New Vehicle Efficiency Standard","QUESTIONS WITHOUT NOTICE","/hansard/chamber.xscript/debate[5]/subdebate.1[19]/answer/interjection[2]/talk.start","N/A","N/A"
"0","0","1","0","1","0","187","Sukkar, Michael MP","242515","Deakin","LP","N/A","342","N/A","New Vehicle Efficiency Standard","QUESTIONS WITHOUT NOTICE","/hansard/chamber.xscript/debate[5]/subdebate.1[19]/answer/interjection[4]/talk.start","N/A","N/A"
"0","0","1","0","1","0","188","Dick, Milton MP ","53517","Oxley","ALP","N/A","342","N/A","New Vehicle Efficiency Standard","QUESTIONS WITHOUT NOTICE","/hansard/chamber.xscript/debate[5]/subdebate.1[19]/answer/interjection[5]/talk.start","N/A","N/A"
"0","0","1","0","1","0","189","Sukkar, Michael MP","242515","Deakin","LP","N/A","342","N/A","New Vehicle Efficiency Standard","QUESTIONS WITHOUT NOTICE","/hansard/chamber.xscript/debate[5]/subdebate.1[19]/answer/interjection[6]/talk.start","N/A","N/A"
"0","0","1","0","1","0","190","Dick, Milton MP ","53517","Oxley","ALP","N/A","342","N/A","New Vehicle Efficiency Standard","QUESTIONS WITHOUT NOTICE","/hansard/chamber.xscript/debate[5]/subdebate.1[19]/answer/interjection[7]/talk.start","N/A","N/A"
"0","0","1","0","1","0","191","Sukkar, Michael MP","242515","Deakin","LP","N/A","342","N/A","New Vehicle Efficiency Standard","QUESTIONS WITHOUT NOTICE","/hansard/chamber.xscript/debate[5]/subdebate.1[19]/answer/interjection[8]/talk.start","N/A","N/A"
"0","0","1","0","1","0","192","Dick, Milton MP ","53517","Oxley","ALP","N/A","342","N/A","New Vehicle Efficiency Standard","QUESTIONS WITHOUT NOTICE","/hansard/chamber.xscript/debate[5]/subdebate.1[19]/answer/interjection[9]/talk.start","N/A","N/A"
"0","0","1","0","1","0","193","Dutton, Peter Craig MP","00AKI","Dickson","LNP","N/A","342","N/A","New Vehicle Efficiency Standard","QUESTIONS WITHOUT NOTICE","/hansard/chamber.xscript/debate[5]/subdebate.1[19]/answer/interjection[11]/talk.start","N/A","N/A"
"0","0","1","0","1","0","194","Dick, Milton MP ","53517","Oxley","ALP","N/A","342","N/A","New Vehicle Efficiency Standard","QUESTIONS WITHOUT NOTICE","/hansard/chamber.xscript/debate[5]/subdebate.1[19]/answer/interjection[12]/talk.start","N/A","N/A"
"0","0","1","0","1","0","195","Dutton, Peter Craig MP","00AKI","Dickson","LNP","N/A","342","N/A","New Vehicle Efficiency Standard","QUESTIONS WITHOUT NOTICE","/hansard/chamber.xscript/debate[5]/subdebate.1[19]/answer/interjection[13]/talk.start","N/A","N/A"
"0","0","1","0","1","0","196","Dick, Milton MP ","53517","Oxley","ALP","N/A","342","N/A","New Vehicle Efficiency Standard","QUESTIONS WITHOUT NOTICE","/hansard/chamber.xscript/debate[5]/subdebate.1[19]/answer/interjection[14]/talk.start","N/A","N/A"
"1","0","0","0","1","0","197","Reid, Gordon MP","300126","Robertson","ALP","N/A","343","My question is to the Minister for Health and Aged Care. How will Labor's tax cuts make sure health workers keep more of what they earn, and how does this build on the government's actions to make health care more affordable and strengthen Medicare after 10 years of cuts and neglect?","Taxation","QUESTIONS WITHOUT NOTICE","/hansard/chamber.xscript/debate[5]/subdebate.1[20]/question/talk.text/body/p","Dr REID (Robertson) ","(15:17):"
"0","1","0","0","1","0","198","Butler, Mark Christopher MP","HWK","Hindmarsh","ALP","N/A","343","I thank the member for his question—this talented, young emergency physician whom we are so fortunate to have as part of our government and part of this parliament. He is part of a growing team of qualified health professionals right across the parliament that are adding real value to our debate around health. I also noticed the member for Robertson up just before question time, speaking in strong support of our laws that are designed to deliver every single one of the 66,000 taxpayers in his electorate a tax cut on 1 July. Many of those workers, just like him, work in the health sector—like the third-year nurse at the Gosford Hospital who, under our laws, will receive a tax cut on 1 July of more than $1,600, around double what they would have received under the old plan from five years ago.  As well as bigger, better tax cuts, the member for Robertson has also relentlessly campaigned for better and cheaper health care on the Central Coast. Indeed, that's why he ran for parliament in the first place. He saw the results of 10 years of cuts and neglect to Medicare every day he went to work as a doctor. His support for bulk-billing investments saw more than 10,000 additional free visits to the doctor on the Central Coast in just the two months of November and December last year. His delivery of the Umina Medicare urgent care clinic is already making a huge difference to his community. One of his constituents, Greg, wrote this to the member: 'Brilliant service, doc. Used this service last week. Was assessed, had X-rays, procedure done, wound cleaned and antibiotics in hand, all in the time it would have taken to find a parking spot at the Gosford Hospital. Get around it, people. A hundred per cent recommended.' After the former government ripped away the right of general practices on the Central Coast to recruit overseas trained GPs, the member for Robertson promised to reverse that decision. We've delivered on that commitment as well. The member for Robertson understands it's not easy to turn around 10 years of cuts and neglect to Medicare that were begun by the Leader of the Opposition during his disastrous period as health minister. The member for Robertson is working so hard to deliver for his community, and is delivering more doctors; delivering more free visits to the GP; delivering cheaper medicines; and, on 1 July, delivering tax cuts for every single taxpayer in his electorate.","Taxation","QUESTIONS WITHOUT NOTICE","/hansard/chamber.xscript/debate[5]/subdebate.1[20]/answer/talk.text/body/p[1]","Mr BUTLER (Hindmarsh—Minister for Health and Aged Care and Deputy Leader of the House) ","(15:17):"
"1","0","0","0","1","0","199","McKenzie, Zoe MP","124514","Flinders","LP","N/A","343","My question is to the Treasurer. Were there any discussions held by the Treasurer or any direction given by him or his office, expressly or implicitly, to the secretary or any other official of the Treasury to provide advice on stage 3 tax cuts before 11 December 2023?","Taxation","QUESTIONS WITHOUT NOTICE","/hansard/chamber.xscript/debate[5]/subdebate.1[21]/question/talk.text/body/p","Ms McKENZIE (Flinders) ","(15:20):"
"0","1","0","0","1","0","200","Chalmers, Jim MP","37998","Rankin","ALP","N/A","343","An hour and 20 minutes into question time, on the Thursday of sitting and in the absence of the shadow Treasurer, that's the best they can come up with. I answered this question earlier in the week; I answered it accurately. The department answered it on Monday before the inquiry chaired by Senator Hume, and we all know what's happening here.","Taxation","QUESTIONS WITHOUT NOTICE","/hansard/chamber.xscript/debate[5]/subdebate.1[21]/answer/talk.text/body/p[1]","Dr CHALMERS (Rankin—Treasurer) ","(15:20):"
"0","1","0","0","1","0","201","Mr Pasin","N/A","N/A","N/A","N/A","N/A","Mr Pasin interjecting—  The Treasurer will pause. The member for Barker is on a warning. I thought it would be a week where he would not get 94 (a) but some things never change. You will leave the chamber under 94 (a). The member for Barker then left the chamber. Dr CHALMERS: I think the whole House knows what's happening here. They can't defend or sustain their position on the actual tax cuts, so they're asking questions about all of the atmospherics and everything that goes around it, because the whole country now knows that they argued against the tax cuts but say they are voting for them. The member for Farrer says, 'Absolutely, we're going to unwind it.' They're all at sea. The opposition leader can't sustain his position for longer than 30 seconds on national television. We all know what's going on here. We have put forward a program of bigger tax cuts for more Australians to help with the cost of living. If they don't want to engage on that then perhaps they should pack up and go home.","Taxation","QUESTIONS WITHOUT NOTICE","/hansard/chamber.xscript/debate[5]/subdebate.1[21]/answer/talk.text/body/a/p","N/A","N/A"
"0","0","1","0","1","0","202","Mr Pasin ","N/A","N/A","N/A","N/A","343","Mr Pasin interjecting—","Taxation","QUESTIONS WITHOUT NOTICE","/hansard/chamber.xscript/debate[5]/subdebate.1[21]/answer/interjection[1]/talk.start","N/A","N/A"
"0","0","1","0","1","0","203","Dick, Milton MP ","53517","Oxley","ALP","N/A","343","N/A","Taxation","QUESTIONS WITHOUT NOTICE","/hansard/chamber.xscript/debate[5]/subdebate.1[21]/answer/interjection[2]/talk.start","N/A","N/A"
"1","0","0","0","1","0","204","Ryan, Joanne MP","249224","Lalor","ALP","N/A","344","My question is to the Prime Minister. Could the Prime Minister outline the government's actions over the summer?","Albanese Government","QUESTIONS WITHOUT NOTICE","/hansard/chamber.xscript/debate[5]/subdebate.1[22]/question/talk.text/body/p","Ms RYAN (Lalor—Chief Government Whip) ","(15:22):"
"0","1","0","0","1","0","205","Albanese, Anthony MP","R36","Grayndler","ALP","N/A","344","I thank the Chief Government Whip for her question. Of course, she was a big supporter of the legislation introduced this week to give a tax cut for every Australian taxpayer and to make sure that these tax cuts were squarely aimed at Middle Australia to make a difference for working people.  But that wasn't all that happened. We had the ACCC investigating pricing and competition in supermarkets. We appointed Dr Emerson to do work as well on those issues, including the Food and Grocery Code of Conduct review. Over the summer, all 58 Medicare urgent care clinics that we promised are now up and running. We had a major Border Force crackdown on the importation of illegal tobacco. We banned importation of disposable single-use vapes. We saw an increase in bulk-billing rates as a result of tripling the bulk-billing incentive—the biggest investment in Medicare that we have seen since it was first introduced 40 years ago—and we celebrated the 40th birthday of Medicare, which is so strong it even survived this bloke as health minister. We improved metastatic cancer data collection. We had an agreement, signed by the education minister, for school funding in WA.We hope this is the first from right across the states and territories. We heard the result of our cheaper childcare. It has resulted in an 11 per cent average reduction for centre based daycare. We opened applications for the first round of funding for social and affordable housing under our Housing Australia Future Fund. We travelled to Far North Queensland and to the Gold Coast to provide assistance for people who had suffered from natural disasters. We provided support in record time, and we provided support on the ground through the Australian Defence Force and other supports. We announced hydrogen hubs in Townsville, and Bell Bay in northern Tasmania. We set national records for rooftop solar generation. And, of course, we had major progress on major infrastructure projects—the M1 extension to Raymond Terrace. The Rockhampton Ring Road is now under construction. The Orange conservatorium is up and running as well— (Time expired)","Albanese Government","QUESTIONS WITHOUT NOTICE","/hansard/chamber.xscript/debate[5]/subdebate.1[22]/answer/talk.text/body/p[1]","Mr ALBANESE (Grayndler—Prime Minister) ","(15:22):"
"1","0","0","0","1","0","206","Pike, Henry MP","300120","Bowman","LNP","N/A","344","My question is to the Prime Minister. Champion Support Services in Thornlands work tirelessly to support those in my community who are experiencing hardship. They reported a tripling in demand for their food relief program during 2023. If Labor's policies are working, why are food bank lines in my electorate three times as long as they were a year ago?","Cost of Living","QUESTIONS WITHOUT NOTICE","/hansard/chamber.xscript/debate[5]/subdebate.1[23]/question/talk.text/body/p","Mr PIKE (Bowman) ","(15:26):"
"0","1","0","0","1","0","207","Albanese, Anthony MP","R36","Grayndler","ALP","N/A","344","I thank the member for Bowman for his question. It goes to the fact that many people on low and middle incomes, as well as people without work, of course, are under financial pressure. That's why we're taking action. Those opposite would have done absolutely nothing.","Cost of Living","QUESTIONS WITHOUT NOTICE","/hansard/chamber.xscript/debate[5]/subdebate.1[23]/answer/talk.text/body/p[1]","Mr ALBANESE (Grayndler—Prime Minister) ","(15:26):"
"0","1","0","0","1","0","208","Opposition members","N/A","N/A","N/A","N/A","N/A","Opposition members interjecting—  Order! Members on my left will cease interjecting. The member for Bowman has asked his question. Mr ALBANESE: One of the first things you can do to provide people with assistance is to ensure that they get access to a job. We've done that with more jobs created on our watch than any other new government in Australian history—650,000 of them! Not only do we want more jobs; we want them to pay more. We want them to be more secure. With the passage of the legislation across in the Senate today, that's precisely what we are doing. Those opposite think it was okay for people who are delivering food to Parliament House here or engaged in the gig economy to have absolutely no minimum standards whatsoever. Nothing! That's what they voted for. We want people to earn more. We want people to be in secure work. But there's something else we want as well. We want people to keep more of what they earn. That is why we've introduced tax cuts to assist Middle Australia on low and middle incomes. Do you think maybe that people on $45,000 a year and less should get a tax cut? We do. That's why we changed the unfair system. It's so that it can deliver for people who are under financial pressure. This mob speak about doing things timely. They worry about the fact that our tax cuts will come in on 1 July, and then they say, 'But five years ago we did something.' We are doing something, as a priority, to deliver every Australian a tax cut. In addition to the tax cuts, of course, there's other legislation before the parliament that will assist 1.2 million people on modest incomes, such as the Medicare levy, to either take them out of the system completely or reduce the amount they have to pay. That's what we have done. We are about providing assistance. Those opposite complained. They said they'd oppose it, that they'd fight it, that they'd roll it back. Now, they say, 'Actually, we're going to vote in favour of it,' but they would never have done anything— (Time expired)","Cost of Living","QUESTIONS WITHOUT NOTICE","/hansard/chamber.xscript/debate[5]/subdebate.1[23]/answer/talk.text/body/p[2]","N/A","N/A"
"0","0","1","0","1","0","209","Dick, Milton MP ","53517","Oxley","ALP","N/A","344","N/A","Cost of Living","QUESTIONS WITHOUT NOTICE","/hansard/chamber.xscript/debate[5]/subdebate.1[23]/answer/interjection/talk.start","N/A","N/A"
"1","0","0","0","1","0","210","Smith, David MP","276714","Bean","ALP","N/A","345","My question is to the Minister for the Arts. Why is documentary an important method of revealing the true nature of Australian stories, and what happens if these stories are not told?","Screen and Visual Arts Industry","QUESTIONS WITHOUT NOTICE","/hansard/chamber.xscript/debate[5]/subdebate.1[24]/question/talk.text/body/p","Mr DAVID SMITH (Bean—Government Whip) ","(15:29):"
"0","1","0","0","1","0","211","Burke, Tony MP","DYW","Watson","ALP","N/A","345","Like the member for Bean, I love a good documentary. We flagged this in our Cultural Policy, where we particularly talked about the national broadcaster.","Screen and Visual Arts Industry","QUESTIONS WITHOUT NOTICE","/hansard/chamber.xscript/debate[5]/subdebate.1[24]/answer/talk.text/body/p[1]","Mr BURKE (Watson—Minister for Employment and Workplace Relations, Minister for the Arts and Leader of the House) ","(15:30):"
"0","1","0","0","1","0","212","Mr Violi","N/A","N/A","N/A","N/A","N/A","Mr Violi interjecting—  The member for Casey is warned! Mr BURKE: On page 87 of the National Cultural Policy, it says: The national broadcasters are the platforms through which audiences engage with some of our best comedy, drama, documentary and children's television. Comedy, drama, documentary and children's television—Nemesis gave us all four!","Screen and Visual Arts Industry","QUESTIONS WITHOUT NOTICE","/hansard/chamber.xscript/debate[5]/subdebate.1[24]/answer/talk.text/body/a[1]/p","N/A","N/A"
"0","1","0","0","1","0","213","Ms Ley","N/A","N/A","N/A","N/A","N/A","Ms Ley interjecting—  Mr BURKE: I don't want to be interrupted by the star of the show. Order! The Leader of the House will pause, and the Deputy Leader of the Opposition will have a real point of order—not a statement, not a joke, not a comment; if she does, there'll be consequences. Out of respect for her office, I give the Deputy Leader of the Opposition the call.","Screen and Visual Arts Industry","QUESTIONS WITHOUT NOTICE","/hansard/chamber.xscript/debate[5]/subdebate.1[24]/answer/talk.text/body/a[2]/p","N/A","N/A"
"0","0","1","0","1","0","214","Mr Violi ","N/A","N/A","N/A","N/A","345","Mr Violi interjecting—","Screen and Visual Arts Industry","QUESTIONS WITHOUT NOTICE","/hansard/chamber.xscript/debate[5]/subdebate.1[24]/answer/interjection[1]/talk.start","N/A","N/A"
"0","0","1","0","1","0","215","Dick, Milton MP ","53517","Oxley","ALP","N/A","345","N/A","Screen and Visual Arts Industry","QUESTIONS WITHOUT NOTICE","/hansard/chamber.xscript/debate[5]/subdebate.1[24]/answer/interjection[2]/talk.start","N/A","N/A"
"0","0","1","0","1","0","216","Ms Ley ","N/A","N/A","N/A","N/A","345","Ms Ley interjecting—","Screen and Visual Arts Industry","QUESTIONS WITHOUT NOTICE","/hansard/chamber.xscript/debate[5]/subdebate.1[24]/answer/interjection[3]/talk.start","N/A","N/A"
"0","0","1","0","1","0","217","Dick, Milton MP ","53517","Oxley","ALP","N/A","345","N/A","Screen and Visual Arts Industry","QUESTIONS WITHOUT NOTICE","/hansard/chamber.xscript/debate[5]/subdebate.1[24]/answer/interjection[4]/talk.start","N/A","N/A"
"0","0","0","1","1","0","218","N/A","N/A","N/A","N/A","N/A","N/A","Ms LEY ( Farrer — Deputy Leader of the Opposition ) ( 15:31 ): On the basis that this is rubbish, I move:  That the Member be no longer heard. The question is that the minister be no longer heard.","Minister for the Arts","MOTIONS","/hansard/chamber.xscript/debate[6]/subdebate.1/speech/talk.text/body/p[1]","N/A","N/A"
"0","0","1","0","1","0","219","Dick, Milton MP ","53517","Oxley","ALP","N/A","345","N/A","Minister for the Arts","MOTIONS","/hansard/chamber.xscript/debate[6]/subdebate.1/speech/interjection/talk.start","N/A","N/A"
