"question_flag","answer_flag","interjection_flag","speech_flag","chamber_flag","stage_direction_flag","speaker_no","name","name.id","electorate","party","role","page.no","content","subdebateinfo","debateinfo","path","Speaker","Time"
"0","0","0","0","1","1","1","N/A","N/A","N/A","N/A","N/A","N/A","Thursday, 8 February 2024","N/A","N/A","/hansard/chamber.xscript/business.start/body/p[1]","N/A","N/A"
"0","0","0","0","1","1","2","N/A","N/A","N/A","N/A","N/A","N/A","The SPEAKER ( Hon. Milton Dick ) was announced by the Serjeant-at-Arms and entered the chamber.","N/A","N/A","/hansard/chamber.xscript/business.start/body/p[2]","N/A","N/A"
"0","0","0","0","1","1","3","N/A","N/A","N/A","N/A","N/A","N/A","The SPEAKER took the chair at 09:46, made an acknowledgement of country and read prayers.","N/A","N/A","/hansard/chamber.xscript/business.start/body/p[3]","N/A","N/A"
"0","0","0","1","1","0","4","N/A","N/A","N/A","N/A","N/A","N/A","On behalf of the House I welcome, as guests, the President of the Senate and honourable senators to this sitting of the House of Representatives to hear an address by the Hon. James Marape MP, Prime Minister of Papua New Guinea.  The Hon. James Marape having been announced and escorted into the chamber— Mr Prime Minister, I welcome you to the House of Representatives chamber. Your address today is a significant occasion in the history of our nation and this House.","Address to Parliament","PRIME MINISTER OF PAPUA NEW GUINEA","/hansard/chamber.xscript/debate[1]/subdebate.1/speech[1]/talk.text/body/p[1]","The SPEAKER ","(09:47):"
"0","0","1","0","1","0","5","Dick, Milton MP ","53517","Oxley","ALP","N/A","305","N/A","Address to Parliament","PRIME MINISTER OF PAPUA NEW GUINEA","/hansard/chamber.xscript/debate[1]/subdebate.1/speech[1]/interjection/talk.start","N/A","N/A"
