"question_flag","answer_flag","interjection_flag","speech_flag","chamber_flag","stage_direction_flag","speaker_no","name","name.id","electorate","party","role","page.no","content","subdebateinfo","debateinfo","path","Speaker","Time"
"0","0","0","1","1","0","24","N/A","N/A","N/A","N/A","N/A","N/A","Yesterday I shared with this place that the greatest show on earth is in the heart of Swan, and that is indeed the Canning Show. CAHRS does a terrific job of running this amazing agricultural show. Dianne Begg, who is the incredible CEO, did her last curtain call, and it will be sad to see an infectious, fun, smart, hardworking woman leave. To David Russell, the new CEO: good luck; you have big heels to fill. Joking!  But what I would say is not a joke is same job, same pay. What was interesting was that at the show there was an air hostess boss lady who clocked me and was like, 'Hey, you're Labor. I love the work that you're doing. I'm an air hostess manager, and other people get paid to do the same job as me for $50,000 more. My team members get paid $30,000 more under different contracts.' The Labor government wants to get rid of this two-tiered system. If you're doing the same job, you should get the same pay. Do you know what the Dutton Liberals think? They don't value your work, and they don't want you to get the same pay. We cannot afford to have a Dutton Liberal government. We are working hard; you deserve the same pay for the same work.","Canning Show, Workplace Relations","STATEMENTS BY MEMBERS","/hansard/chamber.xscript/debate[7]/subdebate.1[2]/speech/talk.text/body/p[1]","Ms MASCARENHAS (Swan) ","(13:31):"
"0","0","0","1","1","0","25","N/A","N/A","N/A","N/A","N/A","N/A","Today I hold petitions signed by 54,464 Australians who are vehemently opposed to the government's mis- and disinformation bill—people who rightly believe this bill is not only a grave threat to freedom of speech but also to our precious democratic values. I'll be delivering these petitions to the Petitions Committee today.  To every Australian who is standing up and speaking out against the government's unprecedented and unparalleled intrusion into our private lives, I say thank you. Hold the line and keep up the pressure. Government overreach is in plain sight for all to see. This bill should send a chill down the spine of every Australian. In my decades of service to this parliament, I've never known such outrageous legislation, which I believe is both unconstitutional and breaches our human rights. It's simple maths. This mis- and disinformation bill plus the social media ban for children under 16 plus digital identity requirements equals tyrannical, state-sanctioned surveillance and censorship. Make no mistake; this is an election issue. Australians know that these bills are an insidious assault on our nation's way of life, sneakily presented under the guise of keeping us safe, but nothing could be further from the truth. They are dangerous, they are a violation of our privacy, and they are an ominous sign of what could be in store for the people of this nation.","Australian Society","STATEMENTS BY MEMBERS","/hansard/chamber.xscript/debate[7]/subdebate.1[3]/speech/talk.text/body/p[1]","Mr BROADBENT (Monash) ","(13:33):"
"0","0","0","1","1","0","26","N/A","N/A","N/A","N/A","N/A","N/A","The annual Wanneroo Show was held last weekend. This beloved event has been a cornerstone of our community since 1909. It brings pioneers, families and friends together to celebrate the spirit of Wanneroo. WA Premier Roger Cook officially opened the show, and it was attended by federal minister Anne Aly and state minister Sabine Winton.  Over the course of two vibrant days, attendees enjoyed a delightful array of activities, including stunning displays in the Margaret Cockman Pavilion, showcasing produce from our local market gardeners, arts and crafts, and floral arrangements. There was something for everyone to enjoy. The horse events captivated many, highlighting the rich agricultural heritage of our region. The entertainment was nothing short of spectacular, with live music and thrilling motorbike stunts, and even breathtaking skydivers. The dazzling fireworks lit up our skies each evening, and these moments of joy remind us of the strength and unity within our community. I extend my heartfelt gratitude to the Wanneroo Agricultural Society and all the volunteers, led by their hardworking president, Dot Newton, whose tireless efforts made this event possible. Her dedication ensures that we continue this cherished tradition. I'm very proud to be a patron of the Wanneroo Show, and I look forward to its continued success for many years to come.","Wanneroo Show","STATEMENTS BY MEMBERS","/hansard/chamber.xscript/debate[7]/subdebate.1[4]/speech/talk.text/body/p[1]","Ms ROBERTS (Pearce) ","(13:34):"
"0","0","0","1","1","0","27","N/A","N/A","N/A","N/A","N/A","N/A","Today I rise to speak about mental health, a critical issue affecting so many Australians. November is a month dedicated to raising awareness about mental health and suicide prevention. Tragically, suicide is a leading cause of death among Australians aged 18 to 24, with nine lives lost every day. This crisis demands urgent national action.  Locally, Warringah is home to incredible organisations making a difference. Mentoring Men, based in Manly, has provided mentorship to men across Australia since 2018. This vital service addresses a reluctance many men feel towards traditional mental health support. With some 2,455 men lost to suicide in 2022, their work is more important than ever. Lifeline Northern Beaches has been serving our community for over 50 years. It offers crisis support, counselling and education. Its fundraising initiatives, such as op shops, book fairs and the iconic Lifeline Classic surfing competition, which we had last weekend, highlights the community's power to drive change. I'd like to commend the Vipers Run Club, a local running group for men, which is aiming to raise $100,000 for Lifeline's services. They're already over halfway there. On a personal note, next week I will be running 100 kilometres in the Ultra-Trail Kosciuszko to fundraise for Lifeline. I urge everyone to remember that mental health is everyone's responsibility.","Mental Health","STATEMENTS BY MEMBERS","/hansard/chamber.xscript/debate[7]/subdebate.1[5]/speech/talk.text/body/p[1]","Ms STEGGALL (Warringah) ","(13:36):"
"0","0","0","1","1","0","28","N/A","N/A","N/A","N/A","N/A","N/A","The Albanese Labor government is committed to northern Australia, to net zero and to us becoming a renewable energy superpower. The north is playing a critical role in supporting the nation's transition to a net zero economy, developing the critical minerals industry, implementing the government's National Defence Strategy and closing the gap on First Nations disadvantage.  The Middle Arm Sustainable Development Precinct will play a key role in the transition to a net zero economy. SunCable and other companies are set to harness the Northern Territory's world-class solar resource, driving green—I prefer to say 'golden'; it's energy from the sun—electricity into Darwin and the broader region. This energy will drive a new wave of green industrial development at Middle Arm. New green industries include critical minerals processing, hydrogen, ammonia, sustainable aviation fuel and data centres. The Greens pretend that Middle Arm has nothing to do with our renewable energy future, and they do that for their own narrow political reasons. Territorians know better, Australians know better, and our regional neighbours know better. Our children's future lies with the renewable energy revolution, and the Territory is at the forefront of that exciting future.","Middle Arm Sustainable Development Precinct","STATEMENTS BY MEMBERS","/hansard/chamber.xscript/debate[7]/subdebate.1[6]/speech/talk.text/body/p[1]","Mr GOSLING (Solomon) ","(13:37):"
"0","0","0","1","1","0","29","N/A","N/A","N/A","N/A","N/A","N/A","Drought conditions in regions across South Australia haven't garnered much attention, despite many parts experiencing deficiencies that mean that rainfall measurements are the lowest on record. We all recognise the impact of low rainfall. What is often not understood is the effect of low soil moisture. City dwellers can simply put on sprinklers, but in the regions low soil moisture is the harbinger of agricultural drought, the failure of crops, the inability to sow and significant financial losses. These losses permeate through the rural economy, affecting everyone, from fodder stores and saleyards to hobby farmers and primary producers. Everyone in a small community is affected.  In Mayo, small square bales, round bales, large squares, chaff and silage have all increased exponentially in price, and that's, of course, if you can find it. Essentially we need this. We need this to feed horses and we need this to feed livestock, particularly when the paddocks are lean. We need to have a national conversation about the low rainfall that South Australia's experiencing. We can't make it rain, but we can consider what supports we should put in place—financial, social or otherwise—and we must be thinking about this now. This is not a conversation for after next winter. So I implore this place to have a conversation about how drought conditions are affecting South Australia.","South Australia: Drought","STATEMENTS BY MEMBERS","/hansard/chamber.xscript/debate[7]/subdebate.1[7]/speech/talk.text/body/p[1]","Ms SHARKIE (Mayo) ","(13:39):"
"0","0","0","1","1","0","30","N/A","N/A","N/A","N/A","N/A","N/A","We need to stand for something in this place. I stand for the needs of the children of Hasluck. I stand for a universal early education system that is affordable and accessible for everyone. I stand for the Albanese government's wage justice for early childhood education and care workers, delivering pay rises that are already encouraging people to stay in these vital occupations. In fact, there are now 30,000 more childcare workers than when we came into office. Childcare costs have also been cut for more than one million families.  I stand for better and fairer schools so that nobody is held back and nobody is left behind. We have already delivered funding agreements with two states—including, of course, Western Australia—and the territories to ensure that all students at government schools are funded to 100 per cent of the school resourcing standard. This much-needed funding has been welcomed by principals of government schools in Hasluck. It is good for schools, good for teachers, good for the families and good for students, and it's brilliant for Australia. I stand for protecting children in the wisest and best way we can, giving them time to be children before negotiating the hazards that exist alongside the opportunities in social media. What do the members opposite stand for? Where is their full support for early childhood workers? Where is their wholehearted agreement that proper funding for government schools is good policy? The people of Hasluck understand that good policy for children needs a Labor government and that they will be worse off under a Liberal-National one. (Time expired)","Education","STATEMENTS BY MEMBERS","/hansard/chamber.xscript/debate[7]/subdebate.1[8]/speech/talk.text/body/p[1]","Ms LAWRENCE (Hasluck) ","(13:40):"
"0","0","0","1","1","0","31","N/A","N/A","N/A","N/A","N/A","N/A","Last week, a press release came out from Minister King and the Prime Minister, acknowledging and taking credit for the completion of the Narrabri to Turrawan upgrade of the railway on the Hunter coal line. Great news—except this government didn't put a razoo into it, and the minister has never been anywhere near Narrabri and wouldn't know where Turrawan was.  The significance of this project, which was entirely funded and conceived by the previous government, is that it connects the Hunter coal line to the Inland Rail at Narrabri. So now we will have higher capacity trains—grain trains and cotton trains—going from Moree and Narrabri into the port of Newcastle. The government dropping the ball on the Inland Rail project has been nothing short of a scandal. We talk a lot in this place about reducing our emissions, road safety, promoting regional development and cheaper prices on supermarket shelves. There's one project that does all of that, Inland Rail. It has 1,700 kilometres of track from Melbourne to Brisbane, taking trucks off the road, reducing carbon emissions and leading to cheaper freight, and this government has dropped the ball. We need a new government in Canberra, someone that understands the importance of regional Australia, to get this project back on track.","Inland Rail","STATEMENTS BY MEMBERS","/hansard/chamber.xscript/debate[7]/subdebate.1[9]/speech/talk.text/body/p[1]","Mr COULTON (Parkes—Chief Nationals Whip) ","(13:42):"
"0","0","0","1","1","0","32","N/A","N/A","N/A","N/A","N/A","N/A","The Albanese Labor government are channelling our inner Freddie Mercury; we want Aussies to break free from barriers to tertiary education. We're doing that by making Elizabeth the home of a brand-new suburban university study hub, making uni more accessible and more affordable by putting higher education on the doorstep of families in the north. This is a Labor government delivering life-changing opportunities where it matters most. We're not stopping there either, because my colleagues and I—all avid Queen fans, I'm sure—want Aussies to break free from disadvantage when it comes to accessing TAFE as well.  The opposition leader must be more of a Cher fan, because all he wants to do is turn back time. All he wants to do is find a way to put these barriers straight back up in front of Aussies and make disadvantaged people even more disadvantaged—because this opposition leader has just told half a million people who are transforming their lives through free TAFE that they should give up on their hopes and dreams, that they don't deserve access to education and that their future is a waste of money. This opposition leader is a disgrace. That man is a risk to opportunity in communities like mine. That man is a risk to the future that Aussies want to pursue, and, with my Labor colleagues, I will fight him every step of the way.","Tertiary Education","STATEMENTS BY MEMBERS","/hansard/chamber.xscript/debate[7]/subdebate.1[10]/speech/talk.text/body/p[1]","Mr BURNELL (Spence) ","(13:43):"
"0","0","0","1","1","0","33","N/A","N/A","N/A","N/A","N/A","N/A","The Leader of the Opposition committed the coalition to a social media age limit of 16 back in June. It should have happened then, but we're pleased it is finally happening now. This issue is urgent. As the Leader of the Opposition has said, we need to pass legislation by next week. The impact of social media on children is one of the defining issues of our era. Parents lie awake at night, worrying about what their kids are being exposed to on Snapchat or TikTok or Instagram. And they are right to worry. We've seen very disturbing mental health trends for Australian children, especially girls, over the past decade. Social media is playing a major role in that devastation.  We welcome the fact that Snapchat is now included in the legislation. Snapchat has brought despair, and sometimes tragedy, to many Australian families. We'll work in good faith with the government to finalise this legislation. In particular, we want to ensure that very robust privacy protections are in place. We want to ensure that social media companies must start right now to implement these laws. There is no time to waste. In June, the Leader of the Opposition made a crucial commitment that sparked a national debate. Next week, we can conclude that debate by all standing together in this place to protect Australian children.","Cybersafety","STATEMENTS BY MEMBERS","/hansard/chamber.xscript/debate[7]/subdebate.1[11]/speech/talk.text/body/p[1]","Mr COLEMAN (Banks) ","(13:45):"
"0","0","0","1","1","0","34","N/A","N/A","N/A","N/A","N/A","N/A","I never went to university, because school just wasn't for me. I know that's the case for many others in my electorate too. However, for a lot of people in the Hunter, going to uni is a pathway they're eager to take. Higher education should be something every person in the country can access, but let's be honest: the Hunter is a vast region. For students here, driving more than an hour to the University of Newcastle campus, on top of managing the heavy workloads that come with being a uni student, creates real challenges. It's easy to see how this puts our local students at a disadvantage compared to their peers and why it might discourage people from my electorate from pursuing education. That's why the recent announcement of a university study hub at Kurri Kurri community centre is such a game changer. It provides people from across the Hunter with the opportunity to study at university without having to leave their home towns or spend hours commuting each day. This makes university a practical and achievable option for many.  I'd also like to give a special shout-out to my friend the member for Paterson. I know how hard you worked on this, and I know how much you care about Kurri Kurri and how you've fought for this project to actually happen there. Thank you for all the work you've put in for this, Member for Paterson, and thank you for how hard you've fought for the people of Kurri Kurri since you were a kid. I'll do my very best for the people of Kurri Kurri and take over from the amazing mark that you've left on their lives. Thank you, Member for Paterson.","Universities","STATEMENTS BY MEMBERS","/hansard/chamber.xscript/debate[7]/subdebate.1[12]/speech/talk.text/body/p[1]","Mr REPACHOLI (Hunter) ","(13:46):"
"0","0","0","1","1","0","35","N/A","N/A","N/A","N/A","N/A","N/A","Today, we honour the life and legacy of Phillip Hughes, a remarkable cricketer from Macksville, in my electorate, whose untimely passing 10 years ago left an indelible mark on our nation. Phillip was not just an extraordinary talent on the cricket field but also a beloved son of Macksville, representing the best of regional Australia with his humility, hard work and determination. In December 2014, our small town stood still as thousands gathered at Macksville High School to bid farewell to Phillip. The cricketing world was present, from Michael Clarke, who movingly described him as his little brother, to legends like Ricky Ponting, Shane Warne and Brian Lara. Prime Minister Tony Abbott, then opposition leader Bill Shorten and community members stood side by side, united in grief and adoration for a young man taken way too soon. Phillip's legacy continues to inspire. The naming of the Pacific Highway bridge over the Nambucca River as the Phillip Hughes Bridge is a fitting tribute to his enduring impact. As we cross that bridge, we are forever reminded of this local hero and remarkable young Australian. Today we reflect on not only the loss of Phillip but also the inspiration Phillip brought to the cricket world and the community. Phillip Hughes—forever in our hearts.","Hughes, Mr Phillip Joel","STATEMENTS BY MEMBERS","/hansard/chamber.xscript/debate[7]/subdebate.1[13]/speech/talk.text/body/p","Mr CONAGHAN (Cowper) ","(13:48):"
"0","0","0","1","1","0","36","N/A","N/A","N/A","N/A","N/A","N/A","I stand here today as a proud member of the Albanese Labor government fighting for real solutions to the cost-of-living crisis that so many families are facing. On this side of the House, we understand that the cost of living is the No. 1 issue for families across the country. In our short time in government, we have delivered energy bill relief, cheaper child care and real solutions to the housing crisis. We have given Australians a tax cut and student debt relief, and we have expanded bulk-billing to make health care affordable for millions.  But what have the Liberals done? They have voted against every one of these measures. They voted against energy bill relief, against cheaper child care, against student debt relief, against strengthening Medicare and against affordable housing, and they are against raising the minimum wage. The Liberals claim to care about Australians, yet they consistently block policies designed to give families a fair go. Labor is delivering for Australian families; the Liberals are standing in the way. But, as Kendrick Lamar would say, if Labor got us, then we gon' be alright.","Cost of Living","STATEMENTS BY MEMBERS","/hansard/chamber.xscript/debate[7]/subdebate.1[14]/speech/talk.text/body/p[1]","Ms FERNANDO (Holt) ","(13:49):"
"0","0","0","1","1","0","37","N/A","N/A","N/A","N/A","N/A","N/A","Last week, I had the pleasure of hosting the shadow minister for health, aged care and sport in my electorate of Fadden. Senator Ruston and I visited a local pharmacy to hear firsthand about the problems with the Labor's failed pharmacy-only vaping model, which was rushed, lacked consultation and sets our frontline health services up to be tobacconists.  We also hosted a round table with local aged-care providers to discuss Labor's Aged Care Bill because we know how important stakeholder feedback is to improving the system. My roundtable attendees included Karen Carey from Arcare Aged Care, Phil Usher and Aaron Lavell from Odyssey Lifestyle Care Communities, Ann Glenister from 501 Care Centre and Sandra Kuppe from Paradise Lakes Care Centre. Lastly, we visited Arcare Parkwood to hear industry feedback on how we might best support our frontline care providers so that they can focus on providing quality care services for our elderly community. The coalition are steadfast in ensuring that we can consult on policies. This is what the government is failing at. Thank you, Senator Ruston, for visiting the Gold Coast and my electorate of Fadden, showing what a future coalition health minister will do: listen to and support our community.","Fadden Electorate: E-Cigarettes and Vaping Products, Fadden Electorate: Aged Care","STATEMENTS BY MEMBERS","/hansard/chamber.xscript/debate[7]/subdebate.1[15]/speech/talk.text/body/p[1]","Mr CALDWELL (Fadden) ","(13:51):"
"0","0","0","1","1","0","38","N/A","N/A","N/A","N/A","N/A","N/A","When it comes to Medicare, the choice is clear. Labor will always work to strengthen it, while the Liberals will do their best to dismantle it. I'm pleased to report that our efforts to strengthen Medicare are working in Bennelong. Labor federally funded the Top Ryde Medicare urgent care clinic, and since 1 July it has delivered world-class medical care to 2,152 patients. Importantly, every one of those 2,152 visits was fully bulk billed. The Top Ryde Medicare urgent care clinic is open seven days a week, from 8 am to 8 pm, and is a huge part of our plan to strengthen Medicare.  We will strengthen Medicare because we believe that Aussies should always be able to access affordable health care when they need it. Four out of five visits in Bennelong are now bulk-billed, and, in the last year alone, Bennelong has had an additional 39,515 bulk-billed visits. People have saved over $6.3 million thanks to our cheaper medicines policies, and, from 1 July 2025, Eastwood and Macquarie Park will have public MRI licences, delivering bulk-billed access to MRI machines for the first time in Bennelong. Under the Liberals, bulk-billing rates plummeted, and medicines became more expensive. The Leader of the Opposition said that there were too many free Medicare services. Under Labor, that's totally different.","Bennelong Electorate: Medicare","STATEMENTS BY MEMBERS","/hansard/chamber.xscript/debate[7]/subdebate.1[16]/speech/talk.text/body/p[1]","Mr LAXALE (Bennelong) ","(13:52):"
"0","0","0","1","1","0","39","N/A","N/A","N/A","N/A","N/A","N/A","I've risen 13 times in this chamber to speak on the local hospital crisis in the Peel region. Labor have been promising to upgrade our local hospital since 2017, and after eight years in government, including a $152 million pledge to fix it, the question is: what have they delivered? I'll tell you what they've delivered. They have delivered record ambulance ramping. They have delivered emergency department delays. They have delivered case study after case study in public health failures. The Peel Labor MPs—David Templeman, Lisa Munday and Robyn Clarke—are missing in action. They have failed our community. Our hardworking doctors, nurses and medical staff are doing their best, and we thank them for that. Day in, day out, they serve our community, but they don't have the resources they need—no extra support, no extra beds and no extra staff.  Labor is failing our community. In March 2017, when the state government was elected, ambulance ramping was 6.9 hours for the month. Last month, that figure skyrocketed to over 364 hours. Labor had a job to do, and they failed to deliver for the community. Our community's hospital must be fixed; our community deserves better. They also deserve better representation in the state parliament. The Liberals are the only party that are committed to fixing the Peel Health Campus.","Canning Electorate: Health Care","STATEMENTS BY MEMBERS","/hansard/chamber.xscript/debate[7]/subdebate.1[17]/speech/talk.text/body/p[1]","Mr HASTIE (Canning) ","(13:54):"
